{
  "record_id": "ds4-trace-001-2026-05-28",
  "trace_id": "trace-20260528-143015-uuid-9876543210",
  "execution_timestamp": "2026-05-28T14:30:15Z",
  "prompt": {
    "content": "Explain the difference between machine learning and deep learning in 2-3 sentences.",
    "format": "text",
    "content_hash": "sha256:b9e8d7c6f5a4e3d2c1b0a9f8e7d6c5b4",
    "token_count": 18,
    "system_prompt": "You are a helpful AI assistant. Provide clear, concise, and accurate responses."
  },
  "response": {
    "content": "Machine learning is a broader field where algorithms learn patterns from data without explicit programming. Deep learning is a subset of machine learning that uses neural networks with multiple layers to automatically learn hierarchical representations from raw data. Deep learning is particularly effective for complex tasks like image recognition and natural language processing.",
    "content_hash": "sha256:f4e3d2c1b0a9f8e7d6c5b4a3e2d1c0b9",
    "token_count": 58,
    "finish_reason": "stop"
  },
  "inference_parameters": {
    "temperature": 0.7,
    "top_p": 0.95,
    "top_k": 40,
    "max_tokens": 2048
  },
  "execution_metrics": {
    "total_duration_ms": 2345,
    "prompt_processing_ms": 245,
    "generation_ms": 2100,
    "tokens_per_second": 27.6,
    "memory_used_mb": 1204
  },
  "binding": {
    "model_identity": "deepseek-v4-flash",
    "model_variant": "int4-quantized",
    "runtime_version": "3f8c2e1a5d9b7c4e2a1f8d3b6c9e2a1f",
    "configuration_hash": "sha256:a1b2c3d4e5f6a7b8c9d0e1f2a3b4c5d6",
    "hardware_profile": "Apple Silicon M2 Pro with 16GB unified memory"
  }
}
